{
  "schemaVersion": 1,
  "provider": "google-search-console",
  "siteId": "officeimo",
  "collectedAtUtc": "2026-08-02T08:00:00Z",
  "sourceKind": "fixture",
  "status": "complete",
  "configurationHash": "sha256:example-fleet-configuration",
  "evidenceReference": "evidence/gsc-officeimo-2026-08-01.json",
  "observations": [
    {
      "date": "2026-08-01",
      "page": "https://officeimo.com/convert/",
      "query": "convert office files",
      "country": "pl",
      "device": "desktop",
      "searchType": "web",
      "clicks": 3,
      "impressions": 240,
      "averagePosition": 9.4
    }
  ]
}
